{
  "as_of": "2026-05-21",
  "source_run_id": "local",
  "window_label": "1y",
  "top_correlated": [
    {
      "ticker_i": "LREN3.SA",
      "ticker_j": "RENT3.SA",
      "correlation": 0.9880011877486722,
      "sector_i": "Consumo C\u00edclico",
      "sector_j": "Consumo C\u00edclico"
    },
    {
      "ticker_i": "BBSE3.SA",
      "ticker_j": "GGBR4.SA",
      "correlation": 0.9872318033162873,
      "sector_i": "Financeiro",
      "sector_j": "Materiais B\u00e1sicos"
    },
    {
      "ticker_i": "PETR3.SA",
      "ticker_j": "PETR4.SA",
      "correlation": 0.9850688735939449,
      "sector_i": "Petr\u00f3leo G\u00e1s e Biocombust\u00edveis",
      "sector_j": "Petr\u00f3leo G\u00e1s e Biocombust\u00edveis"
    },
    {
      "ticker_i": "GOAU4.SA",
      "ticker_j": "LREN3.SA",
      "correlation": 0.9776297017670053,
      "sector_i": "Materiais B\u00e1sicos",
      "sector_j": "Consumo C\u00edclico"
    },
    {
      "ticker_i": "B3SA3.SA",
      "ticker_j": "BBDC4.SA",
      "correlation": 0.9768006586371409,
      "sector_i": "Financeiro",
      "sector_j": "Financeiro"
    },
    {
      "ticker_i": "ENEV3.SA",
      "ticker_j": "FLRY3.SA",
      "correlation": 0.9765937035991262,
      "sector_i": "Utilidade P\u00fablica",
      "sector_j": "Sa\u00fade"
    },
    {
      "ticker_i": "MULT3.SA",
      "ticker_j": "RENT3.SA",
      "correlation": 0.9761728321394297,
      "sector_i": "Financeiro",
      "sector_j": "Consumo C\u00edclico"
    },
    {
      "ticker_i": "LREN3.SA",
      "ticker_j": "MULT3.SA",
      "correlation": 0.9747732966016484,
      "sector_i": "Consumo C\u00edclico",
      "sector_j": "Financeiro"
    },
    {
      "ticker_i": "BBSE3.SA",
      "ticker_j": "ENEV3.SA",
      "correlation": 0.9673243335151096,
      "sector_i": "Financeiro",
      "sector_j": "Utilidade P\u00fablica"
    },
    {
      "ticker_i": "ALOS3.SA",
      "ticker_j": "LREN3.SA",
      "correlation": 0.96691576576511,
      "sector_i": "Consumo N\u00e3o C\u00edclico",
      "sector_j": "Consumo C\u00edclico"
    },
    {
      "ticker_i": "ASAI3.SA",
      "ticker_j": "VAMO3.SA",
      "correlation": 0.9662147287152498,
      "sector_i": "Consumo N\u00e3o C\u00edclico",
      "sector_j": "Bens Industriais"
    },
    {
      "ticker_i": "ALOS3.SA",
      "ticker_j": "RENT3.SA",
      "correlation": 0.9660101663218456,
      "sector_i": "Consumo N\u00e3o C\u00edclico",
      "sector_j": "Consumo C\u00edclico"
    },
    {
      "ticker_i": "BBDC4.SA",
      "ticker_j": "GOAU4.SA",
      "correlation": 0.9649511566837826,
      "sector_i": "Financeiro",
      "sector_j": "Materiais B\u00e1sicos"
    },
    {
      "ticker_i": "BBSE3.SA",
      "ticker_j": "GOAU4.SA",
      "correlation": 0.9594397151293403,
      "sector_i": "Financeiro",
      "sector_j": "Materiais B\u00e1sicos"
    },
    {
      "ticker_i": "ALOS3.SA",
      "ticker_j": "MULT3.SA",
      "correlation": 0.959160046752432,
      "sector_i": "Consumo N\u00e3o C\u00edclico",
      "sector_j": "Financeiro"
    },
    {
      "ticker_i": "GGBR4.SA",
      "ticker_j": "GOAU4.SA",
      "correlation": 0.9575600590653528,
      "sector_i": "Materiais B\u00e1sicos",
      "sector_j": "Materiais B\u00e1sicos"
    },
    {
      "ticker_i": "BBDC4.SA",
      "ticker_j": "LREN3.SA",
      "correlation": 0.9573405763844866,
      "sector_i": "Financeiro",
      "sector_j": "Consumo C\u00edclico"
    },
    {
      "ticker_i": "ASAI3.SA",
      "ticker_j": "RADL3.SA",
      "correlation": 0.9545579441111554,
      "sector_i": "Consumo N\u00e3o C\u00edclico",
      "sector_j": "Sa\u00fade"
    },
    {
      "ticker_i": "ALOS3.SA",
      "ticker_j": "BBDC4.SA",
      "correlation": 0.954060276116801,
      "sector_i": "Consumo N\u00e3o C\u00edclico",
      "sector_j": "Financeiro"
    },
    {
      "ticker_i": "EQTL3.SA",
      "ticker_j": "RDOR3.SA",
      "correlation": 0.9537991021143226,
      "sector_i": "Utilidade P\u00fablica",
      "sector_j": "Sa\u00fade"
    },
    {
      "ticker_i": "GOAU4.SA",
      "ticker_j": "HYPE3.SA",
      "correlation": 0.9537398153950064,
      "sector_i": "Materiais B\u00e1sicos",
      "sector_j": "Sa\u00fade"
    },
    {
      "ticker_i": "ENEV3.SA",
      "ticker_j": "GGBR4.SA",
      "correlation": 0.9512155506996415,
      "sector_i": "Utilidade P\u00fablica",
      "sector_j": "Materiais B\u00e1sicos"
    },
    {
      "ticker_i": "GOAU4.SA",
      "ticker_j": "VAMO3.SA",
      "correlation": 0.9499741213151804,
      "sector_i": "Materiais B\u00e1sicos",
      "sector_j": "Bens Industriais"
    },
    {
      "ticker_i": "BBAS3.SA",
      "ticker_j": "SANB11.SA",
      "correlation": 0.9492191061369435,
      "sector_i": "Financeiro",
      "sector_j": "Financeiro"
    },
    {
      "ticker_i": "ALOS3.SA",
      "ticker_j": "GOAU4.SA",
      "correlation": 0.9490177765916049,
      "sector_i": "Consumo N\u00e3o C\u00edclico",
      "sector_j": "Materiais B\u00e1sicos"
    },
    {
      "ticker_i": "CSNA3.SA",
      "ticker_j": "ITSA4.SA",
      "correlation": 0.9487150321877067,
      "sector_i": "Materiais B\u00e1sicos",
      "sector_j": "Financeiro"
    },
    {
      "ticker_i": "BPAC11.SA",
      "ticker_j": "VAMO3.SA",
      "correlation": 0.9483869509506935,
      "sector_i": "Financeiro",
      "sector_j": "Bens Industriais"
    },
    {
      "ticker_i": "LREN3.SA",
      "ticker_j": "VAMO3.SA",
      "correlation": 0.9481678945826867,
      "sector_i": "Consumo C\u00edclico",
      "sector_j": "Bens Industriais"
    },
    {
      "ticker_i": "ALPA4.SA",
      "ticker_j": "ENGI11.SA",
      "correlation": 0.9474144300358054,
      "sector_i": "Consumo C\u00edclico",
      "sector_j": "Utilidade P\u00fablica"
    },
    {
      "ticker_i": "ENGI11.SA",
      "ticker_j": "RENT3.SA",
      "correlation": 0.9472320288494087,
      "sector_i": "Utilidade P\u00fablica",
      "sector_j": "Consumo C\u00edclico"
    },
    {
      "ticker_i": "BBDC4.SA",
      "ticker_j": "VAMO3.SA",
      "correlation": 0.9453512071421707,
      "sector_i": "Financeiro",
      "sector_j": "Bens Industriais"
    },
    {
      "ticker_i": "RADL3.SA",
      "ticker_j": "RDOR3.SA",
      "correlation": 0.9452959366677773,
      "sector_i": "Sa\u00fade",
      "sector_j": "Sa\u00fade"
    },
    {
      "ticker_i": "BPAC11.SA",
      "ticker_j": "MULT3.SA",
      "correlation": 0.9438931274170483,
      "sector_i": "Financeiro",
      "sector_j": "Financeiro"
    },
    {
      "ticker_i": "GOAU4.SA",
      "ticker_j": "MULT3.SA",
      "correlation": 0.9437953833737025,
      "sector_i": "Materiais B\u00e1sicos",
      "sector_j": "Financeiro"
    },
    {
      "ticker_i": "CSAN3.SA",
      "ticker_j": "ITUB4.SA",
      "correlation": 0.9433425889223473,
      "sector_i": "Petr\u00f3leo G\u00e1s e Biocombust\u00edveis",
      "sector_j": "Financeiro"
    },
    {
      "ticker_i": "BPAC11.SA",
      "ticker_j": "GOAU4.SA",
      "correlation": 0.9425463207964688,
      "sector_i": "Financeiro",
      "sector_j": "Materiais B\u00e1sicos"
    },
    {
      "ticker_i": "RENT3.SA",
      "ticker_j": "SANB11.SA",
      "correlation": 0.9422034151252726,
      "sector_i": "Consumo C\u00edclico",
      "sector_j": "Financeiro"
    },
    {
      "ticker_i": "BPAC11.SA",
      "ticker_j": "LREN3.SA",
      "correlation": 0.9416310935428125,
      "sector_i": "Financeiro",
      "sector_j": "Consumo C\u00edclico"
    },
    {
      "ticker_i": "ENEV3.SA",
      "ticker_j": "GOAU4.SA",
      "correlation": 0.9415820988296931,
      "sector_i": "Utilidade P\u00fablica",
      "sector_j": "Materiais B\u00e1sicos"
    },
    {
      "ticker_i": "FLRY3.SA",
      "ticker_j": "GOAU4.SA",
      "correlation": 0.9401454581075525,
      "sector_i": "Sa\u00fade",
      "sector_j": "Materiais B\u00e1sicos"
    },
    {
      "ticker_i": "FLRY3.SA",
      "ticker_j": "LREN3.SA",
      "correlation": 0.9391219583512084,
      "sector_i": "Sa\u00fade",
      "sector_j": "Consumo C\u00edclico"
    },
    {
      "ticker_i": "BBDC4.SA",
      "ticker_j": "BBSE3.SA",
      "correlation": 0.9389287503310607,
      "sector_i": "Financeiro",
      "sector_j": "Financeiro"
    },
    {
      "ticker_i": "GOAU4.SA",
      "ticker_j": "RENT3.SA",
      "correlation": 0.9386215716444062,
      "sector_i": "Materiais B\u00e1sicos",
      "sector_j": "Consumo C\u00edclico"
    },
    {
      "ticker_i": "RADL3.SA",
      "ticker_j": "VAMO3.SA",
      "correlation": 0.9383878105475838,
      "sector_i": "Sa\u00fade",
      "sector_j": "Bens Industriais"
    },
    {
      "ticker_i": "BPAC11.SA",
      "ticker_j": "RENT3.SA",
      "correlation": 0.9377963894278722,
      "sector_i": "Financeiro",
      "sector_j": "Consumo C\u00edclico"
    },
    {
      "ticker_i": "BBDC4.SA",
      "ticker_j": "ENEV3.SA",
      "correlation": 0.9369554856742318,
      "sector_i": "Financeiro",
      "sector_j": "Utilidade P\u00fablica"
    },
    {
      "ticker_i": "ITSA4.SA",
      "ticker_j": "ITUB4.SA",
      "correlation": 0.9365738166401116,
      "sector_i": "Financeiro",
      "sector_j": "Financeiro"
    },
    {
      "ticker_i": "ALOS3.SA",
      "ticker_j": "RADL3.SA",
      "correlation": 0.9364334967495787,
      "sector_i": "Consumo N\u00e3o C\u00edclico",
      "sector_j": "Sa\u00fade"
    },
    {
      "ticker_i": "RENT3.SA",
      "ticker_j": "VAMO3.SA",
      "correlation": 0.936025780560803,
      "sector_i": "Consumo C\u00edclico",
      "sector_j": "Bens Industriais"
    },
    {
      "ticker_i": "ENGI11.SA",
      "ticker_j": "LREN3.SA",
      "correlation": 0.9358014538732546,
      "sector_i": "Utilidade P\u00fablica",
      "sector_j": "Consumo C\u00edclico"
    }
  ],
  "top_anti_correlated": [
    {
      "ticker_i": "ABEV3.SA",
      "ticker_j": "PRIO3.SA",
      "correlation": -0.8261659587948743,
      "sector_i": "Consumo N\u00e3o C\u00edclico",
      "sector_j": "Petr\u00f3leo G\u00e1s e Biocombust\u00edveis"
    },